{
  "$schema": "https://json-schema.org/draft/2020-12/schema",
  "$id": "https://media-monitor/contracts/news_seed_idea.v1.json",
  "title": "news_seed_idea.v1",
  "description": "Experimental structured seed idea from PromptFlow generated outputs.",
  "type": "object",
  "additionalProperties": false,
  "properties": {
    "schema_name": {
      "const": "news_seed_idea.v1"
    },
    "schema_status": {
      "const": "experimental_structured"
    },
    "digest_group_id": {
      "type": "string",
      "minLength": 1
    },
    "idea_id": {
      "type": "string",
      "minLength": 1
    },
    "topic": {
      "type": "string",
      "minLength": 1
    },
    "headline": {
      "type": "string",
      "minLength": 1
    },
    "format_candidates": {
      "type": "string",
      "enum": [
        "article",
        "yt_script",
        "both"
      ],
      "description": "Formato editorial candidato para desarrollo del seed idea."
    },
    "working_title": {
      "type": "string",
      "minLength": 1
    },
    "angle": {
      "type": "string",
      "minLength": 1
    },
    "why_now": {
      "type": "string",
      "minLength": 1
    },
    "supporting_refs": {
      "type": "array",
      "items": {
        "type": "string",
        "minLength": 1
      }
    },
    "risk_notes": {
      "type": "string"
    },
    "dek": {
      "type": "string"
    },
    "rationale": {
      "type": "string"
    },
    "supporting_article_ids": {
      "type": "array",
      "items": {
        "type": "string",
        "minLength": 1
      }
    }
  },
  "required": [
    "schema_name",
    "schema_status",
    "digest_group_id",
    "idea_id",
    "topic",
    "headline",
    "supporting_article_ids"
  ]
}
